{
  "name": "alberto-skills",
  "owner": {
    "name": "Alberto Leal",
    "email": "mail4alberto@gmail.com"
  },
  "metadata": {
    "description": "Personal marketplace for custom skills and plugins",
    "version": "0.1.0"
  },
  "plugins": [
    {
      "name": "skill-creator",
      "source": "./plugins/skill-creator",
      "description": "Tool for creating and managing Agent Skills. Sourced from Anthropic's official skills repository.",
      "repository": "https://github.com/anthropics/skills/tree/main/skill-creator",
      "strict": false,
      "skills": ["./"]
    },
    {
      "name": "git-absorb",
      "source": "./plugins/git-absorb",
      "description": "Automatically fold uncommitted changes into appropriate commits. Use for applying review feedback and maintaining atomic commit history.",
      "repository": "https://github.com/tummychow/git-absorb",
      "strict": false,
      "skills": ["./"]
    }
  ]
}
